Title,Price,image
Canon EOS 1500D DSLR Camera Body+ 18-55 mm IS II Lens,"₹36,499",https://rukminim2.flixcart.com/image/312/312/kk01pjk0/dslr-camera/f/v/o/eos-1500d-canon-original-imafzfugydh2mjgf.jpeg?q=70
Canon EOS 200D II DSLR Camera EF-S18-55mm IS STM,"₹56,499",https://rukminim2.flixcart.com/image/312/312/juwzf680/dslr-camera/g/a/q/200d-ii-200d-ii-canon-original-imaffvrhzyqzayys.jpeg?q=70
"Canon EOS 3000D DSLR Camera 1 Camera Body, 18 - 55 mm Lens","₹26,999",https://rukminim2.flixcart.com/image/312/312/jfbfde80/camera/n/r/n/canon-eos-eos-3000d-dslr-original-imaf3t5h9yuyc5zu.jpeg?q=70
NIKON Z7 II Kit Mirrorless Camera 24-70mm F/4S with 64GB UHS-II SD Card,"₹2,73,599",https://rukminim2.flixcart.com/image/312/312/kq9ta4w0/dslr-camera/r/1/y/z7-ii-z7-ii-kit-nikon-original-imag4btqp52rdzgp.jpeg?q=70
Panasonic G Series DC-G95HGW-K Mirrorless Camera G95 with 14-140mm lens,"₹95,873",https://rukminim2.flixcart.com/image/312/312/jynat8w0/dslr-camera/y/z/g/dc-g95hgw-k-dc-g95hgw-k-panasonic-original-imafgu2j4nauf2na.jpeg?q=70
Canon EOS 3925C010A DSLR Camera 1,"₹86,995",https://rukminim2.flixcart.com/image/312/312/kz4gh3k0/dslr-camera/l/5/1/eos-850d-ef-s-18-55mm-f-4-5-6-is-stm-24-1-3925c010a-canon-original-imagb7dhddz7hqax.jpeg?q=70
FUJIFILM X Series X-T200 Mirrorless Camera Body with 15-45 mm Lens,"₹61,999",https://rukminim2.flixcart.com/image/312/312/k8g8knk0/dslr-camera/s/g/v/x-t200-x-t200-fujifilm-original-imafqggmvuazabpa.jpeg?q=70
NIKON D750 DSLR Camera Body with Single Lens: 24-120mm VR Lens,"₹1,58,490",https://rukminim2.flixcart.com/image/312/312/juu4jgw0/dslr-camera/d/9/c/d750-black-d750-nikon-original-imaffv8y2y3mamqm.jpeg?q=70
FUJIFILM X Series X-T4 Mirrorless Camera Body with XF 16-80mm Lens,"₹1,85,999",https://rukminim2.flixcart.com/image/312/312/kamtsi80/dslr-camera/z/h/f/x-t4-26-mp-x-t4-fujifilm-original-imafs5jxc4zakajw.jpeg?q=70
NIKON Z5 Mirrorless Camera 24-50 mm,"₹1,24,538",https://rukminim2.flixcart.com/image/312/312/kokdci80/dslr-camera/5/w/6/z-24-50mm-z5-nikon-original-imag2zugmcsgfhf3.jpeg?q=70
FUJIFILM X Series X-T200 Mirrorless Camera Body with 15-45 mm Lens,"₹61,999",https://rukminim2.flixcart.com/image/312/312/k8g8knk0/dslr-camera/w/7/h/x-t200-x-t200-fujifilm-original-imafqggzygaykbzh.jpeg?q=70
FUJIFILM X Series X-E4 Mirrorless Camera Body with XF 27 mm F2.8 R WR Prime Lens,"₹89,999",https://rukminim2.flixcart.com/image/312/312/kmds4nk0/dslr-camera/l/r/f/x-e4-x-e4-fujifilm-original-imagfazttxmjtpdx.jpeg?q=70
"NIKON Z FC SL 16-50MM F/3.5-6.3 VR SL Kit DSLR Camera 64 GB SD Card, Bckpack 150 & EN-EL25","₹96,495",https://rukminim2.flixcart.com/image/312/312/ksj9dow0/dslr-camera/q/p/2/nik01128-20-9-z-fc-sl-16-50mm-f-3-5-6-3-vr-sl-kit-nikon-original-imag62ujmbcjjzwt.jpeg?q=70
Panasonic Lumix DMC-GH4 Mirrorless Camera Body with 12-60mm Lens,"₹73,999",https://rukminim2.flixcart.com/image/312/312/k79dd3k0/dslr-camera/m/w/g/lumix-dmc-gh4m-lumix-dmc-gh4m-panasonic-original-imafpjhvgzq5qxgv.jpeg?q=70
POZUB New Arrival Best Buy 3in1 Multi-Purpose Selfie Stick Stand With Dustproof Bag PZB-XT012 Travel T...,₹425,https://rukminim2.flixcart.com/image/312/312/ktx9si80/camera/9/d/e/stand-new-arrival-best-buy-3in1-multi-purpose-selfie-stick-stand-original-imag75xqhmuxvhy5.jpeg?q=70
NIKON Z5 Mirrorless Camera Z 5 Body,"₹95,290",https://rukminim2.flixcart.com/image/312/312/kokdci80/dslr-camera/c/n/w/z-5-body-z5-nikon-original-imag2zugujc7aeva.jpeg?q=70
FUJIFILM X-T3 Mirrorless Camera Body Only,"₹1,00,999",https://rukminim2.flixcart.com/image/312/312/jpcxrww0/dslr-camera/w/4/z/x-t3-x-t3-fujifilm-original-imafbhht5whwtee5.jpeg?q=70
NIKON Z5 Mirrorless Camera 24-70 mm,"₹1,39,533",https://rukminim2.flixcart.com/image/312/312/kokdci80/dslr-camera/a/g/a/z-24-70mm-z5-nikon-original-imag2zugqzjmsth3.jpeg?q=70
FUJIFILM X Series X-T4 Mirrorless Camera Body with XF 18-55mm Lens,"₹1,71,999",https://rukminim2.flixcart.com/image/312/312/ken59jk0/dslr-camera/c/d/y/x-t4-mirrorless-camera-body-with-xf-18-55mm-lens-x-t4-fujifilm-original-imafv9xzxunvxkng.jpeg?q=70
NIKON Z5 Mirrorless Camera 24-200 mm,"₹1,59,136",https://rukminim2.flixcart.com/image/312/312/kokdci80/dslr-camera/v/e/x/z-24-200mm-z5-nikon-original-imag2zuekuxgxsgg.jpeg?q=70
POZUB New Arrival 3in1 Selfie Stick Stand With Dustproof Bag PZB-XT012 Travel Tripod Stand Flexible Ha...,₹448,https://rukminim2.flixcart.com/image/312/312/ktx9si80/camera/t/w/z/stand-new-arrival-3in1-selfie-stick-stand-with-dustproof-bag-pzb-original-imag75x7evgnza7t.jpeg?q=70
FUJIFILM X-Series X-E4 Mirrorless Camera Body Only,"₹74,499",https://rukminim2.flixcart.com/image/312/312/kmp7ngw0/dslr-camera/e/t/a/x-e4-x-e4-fujifilm-original-imagfjp5bm7rpggf.jpeg?q=70
NIKON Z 6 Mirrorless Camera Body with 24-70mm Lens and Mount Adapter FTZ,"₹1,74,999",https://rukminim2.flixcart.com/image/312/312/jpa2w7k0/dslr-camera/z/m/5/na-z-6-nikon-original-imafbk4gpzfbgafs.jpeg?q=70
POZUB Best Buy 3in1 Stand Selfie Stick With Dustproof Bag Travel Tripod Stand PZB-XT012 Flexible Handh...,₹447,https://rukminim2.flixcart.com/image/312/312/ktx9si80/camera/p/f/b/stand-best-buy-3in1-stand-selfie-stick-with-dustproof-bag-travel-original-imag75xy87jz9r6z.jpeg?q=70
